{
  "schema_version": 1,
  "mod_id": "moogs_structures",
  "installed_version": "3.1.2",
  "pack_snapshot_sha": "efd23bcffc6553f6f423cd4b5576e2732ad7e938",
  "researched_on": "2026-10-21",
  "data_class": "external_native_mechanics_evidence_not_canonical_gameplay",
  "sources": [
    {
      "id": "installed_metadata",
      "url": "https://modrinth.com/mod/moogs-structure-lib",
      "publisher": "FinnDog",
      "scope": "installed_static",
      "reviewed_on": "2026-10-21",
      "artifact_evidence": {
        "path": "Client/ManagedPack/mods/MoogsStructureLib-forge-1.20-3.1.2.jar",
        "sha256": "6717ea463696df6729e8f63b2a0c0ed174b73678d413e674afd0b113ee22e18a",
        "resource": "META-INF/mods.toml"
      }
    },
    {
      "id": "author_project",
      "url": "https://modrinth.com/mod/moogs-structure-lib",
      "publisher": "Moog's Structure Lib (moogs_structures) project authors",
      "scope": "project_page",
      "reviewed_on": "2026-10-21"
    }
  ],
  "observations": [
    {
      "key": "moogs_structures:installed_role",
      "kind": "compatibility",
      "title": "Moog's Structure Lib role and integration boundary",
      "player_action": "Use the consuming mod's interface or feature; this component's own installation is not a survival objective.",
      "outcome": "Provides data-driven structure-generation support for Moog's content modules; the content modules supply structures, placements and loot rather than the library inventing them.",
      "registry_refs": [],
      "depends_on": [],
      "conditions": [
        "Exact installed artifact metadata was inspected; current author pages can cover newer versions.",
        "No runtime behavior or benchmark was verified; do not change installed configuration from these research notes."
      ],
      "source_ids": [
        "installed_metadata",
        "author_project"
      ],
      "verification": "EXTERNAL_SOURCE_ONLY",
      "runtime_verified": false,
      "quest_seed": null,
      "review_note": "Installed static role is corroborated by the artifact/resource/SHA256 attached to the source. Public URL identifies the upstream project, not a claim that a missing web guide was read. Multiple packaged versions remain loader-resolution candidates: 3.1.2"
    }
  ]
}
