{
  "schema_version": 1,
  "mod_id": "badoptimizations",
  "installed_version": "2.4.1",
  "pack_snapshot_sha": "efd23bcffc6553f6f423cd4b5576e2732ad7e938",
  "researched_on": "2026-10-21",
  "data_class": "external_native_mechanics_evidence_not_canonical_gameplay",
  "sources": [
    {
      "id": "installed_metadata",
      "url": "https://modrinth.com/mod/badoptimizations",
      "publisher": "Thosea",
      "scope": "installed_static",
      "reviewed_on": "2026-10-21",
      "artifact_evidence": {
        "path": "Client/ManagedPack/mods/BadOptimizations-2.4.1-1.20.1.jar",
        "sha256": "3da53cdf856757d9ec7df0be86bc23b2c7d67a019b490f8f64317d4d9b77cac8",
        "resource": "META-INF/mods.toml"
      }
    },
    {
      "id": "author_project",
      "url": "https://modrinth.com/mod/badoptimizations",
      "publisher": "BadOptimizations project authors",
      "scope": "project_page",
      "reviewed_on": "2026-10-21"
    }
  ],
  "observations": [
    {
      "key": "badoptimizations:installed_role",
      "kind": "compatibility",
      "title": "BadOptimizations role and integration boundary",
      "player_action": "Use the consuming mod's interface or feature; this component's own installation is not a survival objective.",
      "outcome": "Caches unchanged lightmap and sky-colour calculations and avoids unused debug-render work; each optimization can be disabled in configuration.",
      "registry_refs": [],
      "depends_on": [],
      "conditions": [
        "Exact installed artifact metadata was inspected; current author pages can cover newer versions.",
        "No runtime behavior or benchmark was verified; do not change installed configuration from these research notes."
      ],
      "source_ids": [
        "installed_metadata",
        "author_project"
      ],
      "verification": "EXTERNAL_SOURCE_ONLY",
      "runtime_verified": false,
      "quest_seed": null,
      "review_note": "Installed static role is corroborated by the artifact/resource/SHA256 attached to the source. Public URL identifies the upstream project, not a claim that a missing web guide was read. Multiple packaged versions remain loader-resolution candidates: 2.4.1"
    }
  ]
}
