{
  "schema_version": 1,
  "mod_id": "pehkui",
  "installed_version": "3.8.2+1.20.1-forge",
  "pack_snapshot_sha": "efd23bcffc6553f6f423cd4b5576e2732ad7e938",
  "researched_on": "2026-10-21",
  "data_class": "external_native_mechanics_evidence_not_canonical_gameplay",
  "sources": [
    {
      "id": "installed_metadata",
      "url": "https://modrinth.com/mod/pehkui",
      "publisher": "Virtuoel",
      "scope": "installed_static",
      "reviewed_on": "2026-10-21",
      "artifact_evidence": {
        "path": "Client/ManagedPack/mods/Pehkui-3.8.2+1.20.1-forge.jar",
        "sha256": "54210f454c166f65a1bcbbfe4ea52e6f73e07844a793c7132f1af4076a0f42fc",
        "resource": "META-INF/mods.toml"
      }
    },
    {
      "id": "author_project",
      "url": "https://modrinth.com/mod/pehkui",
      "publisher": "Pehkui project authors",
      "scope": "project_page",
      "reviewed_on": "2026-10-21"
    }
  ],
  "observations": [
    {
      "key": "pehkui:installed_role",
      "kind": "compatibility",
      "title": "Pehkui role and integration boundary",
      "player_action": "Use the consuming mod's interface or feature; this component's own installation is not a survival objective.",
      "outcome": "Exposes entity scale types and commands for changing sizes; exact scaling types, permission checks and persistence must be taken from the installed version and server rules.",
      "registry_refs": [],
      "depends_on": [],
      "conditions": [
        "Exact installed artifact metadata was inspected; current author pages can cover newer versions.",
        "No runtime behavior or benchmark was verified; do not change installed configuration from these research notes."
      ],
      "source_ids": [
        "installed_metadata",
        "author_project"
      ],
      "verification": "EXTERNAL_SOURCE_ONLY",
      "runtime_verified": false,
      "quest_seed": null,
      "review_note": "Installed static role is corroborated by the artifact/resource/SHA256 attached to the source. Public URL identifies the upstream project, not a claim that a missing web guide was read. Multiple packaged versions remain loader-resolution candidates: 3.8.2+1.20.1-forge"
    },
    {
      "key": "pehkui:scale_command_boundary",
      "kind": "interaction",
      "title": "Use server-authorized scale operations",
      "player_action": "Have an authorized operator inspect the installed scale command and type before changing an entity's size.",
      "outcome": "Scaling is expressed through specific scale types and affects supported entity properties; a visual model size change is not a verified promise about every mod's collision or combat integration.",
      "registry_refs": [],
      "depends_on": [],
      "conditions": [
        "Follow the installed consumer and server configuration; exact default keybindings and optional integration behavior were not runtime-verified."
      ],
      "source_ids": [
        "installed_metadata",
        "author_project"
      ],
      "verification": "EXTERNAL_SOURCE_ONLY",
      "runtime_verified": false,
      "quest_seed": null
    }
  ]
}
