{
  "schema_version": 1,
  "mod_id": "fabric_renderer_indigo",
  "installed_version": "${file.jarVersion}",
  "pack_snapshot_sha": "efd23bcffc6553f6f423cd4b5576e2732ad7e938",
  "researched_on": "2026-10-21",
  "data_class": "external_native_mechanics_evidence_not_canonical_gameplay",
  "sources": [
    {
      "id": "installed_module",
      "url": "https://github.com/Sinytra/ForgifiedFabricAPI",
      "publisher": "FabricMC / Sinytra",
      "scope": "installed_static",
      "reviewed_on": "2026-10-21",
      "artifact_evidence": {
        "path": "Client/ManagedPack/mods/SnowRealMagic-1.20.1-Forge-10.7.0.jar!/META-INF/jarjar/fabric-renderer-indigo-1.5.3+b5b2da4177.jar",
        "sha256": "8d63fae3672a2084bd93bcb8bb50c70a108658059b6adaa861e6ec52e40932a5",
        "resource": "META-INF/mods.toml"
      }
    },
    {
      "id": "upstream_family",
      "url": "https://github.com/FabricMC/fabric-api",
      "publisher": "FabricMC",
      "scope": "project_page",
      "reviewed_on": "2026-10-21"
    }
  ],
  "observations": [
    {
      "key": "fabric_renderer_indigo:module_contract",
      "kind": "integration",
      "title": "fabric renderer indigo integration role",
      "player_action": "No separate player interaction; a consuming mod calls this API.",
      "outcome": "Implements the default rendering API.",
      "registry_refs": [],
      "depends_on": [],
      "conditions": [
        "Installed embedded module metadata supplies the specific role; the public repository describes the API family.",
        "This Forge pack contains Forgified API modules; their presence is not permission to install arbitrary Fabric artifacts.",
        "No independent survival objective applies to an API module."
      ],
      "source_ids": [
        "installed_module",
        "upstream_family"
      ],
      "verification": "EXTERNAL_SOURCE_ONLY",
      "runtime_verified": false,
      "quest_seed": null,
      "review_note": "Source locator includes the exact outer artifact and nested JAR path. Runtime API consumption and loader resolution were not exercised."
    }
  ]
}
