{
  "schema_version": 1,
  "mod_id": "fabric_command_api_v2",
  "installed_version": "${file.jarVersion}",
  "pack_snapshot_sha": "efd23bcffc6553f6f423cd4b5576e2732ad7e938",
  "researched_on": "2026-10-21",
  "data_class": "external_native_mechanics_evidence_not_canonical_gameplay",
  "sources": [
    {
      "id": "installed_module",
      "url": "https://github.com/Sinytra/ForgifiedFabricAPI",
      "publisher": "FabricMC / Sinytra",
      "scope": "installed_static",
      "reviewed_on": "2026-10-21",
      "artifact_evidence": {
        "path": "Client/ManagedPack/mods/txnilib-forge-1.0.24-1.20.1.jar!/META-INF/jars/fabric-api-0.92.2+1.11.12+1.20.1.jar!/META-INF/jarjar/fabric-command-api-v2-2.2.13+561530ec77.jar",
        "sha256": "cc106c66f7cba3674599c76460bbad77a3b644b8fbaced0fe474b55bf5456c3b",
        "resource": "META-INF/mods.toml"
      }
    },
    {
      "id": "upstream_family",
      "url": "https://github.com/FabricMC/fabric-api",
      "publisher": "FabricMC",
      "scope": "project_page",
      "reviewed_on": "2026-10-21"
    }
  ],
  "observations": [
    {
      "key": "fabric_command_api_v2:module_contract",
      "kind": "integration",
      "title": "fabric command api v2 integration role",
      "player_action": "No separate player interaction; a consuming mod calls this API.",
      "outcome": "Provides current command hooks.",
      "registry_refs": [],
      "depends_on": [],
      "conditions": [
        "Installed embedded module metadata supplies the specific role; the public repository describes the API family.",
        "This Forge pack contains Forgified API modules; their presence is not permission to install arbitrary Fabric artifacts.",
        "No independent survival objective applies to an API module."
      ],
      "source_ids": [
        "installed_module",
        "upstream_family"
      ],
      "verification": "EXTERNAL_SOURCE_ONLY",
      "runtime_verified": false,
      "quest_seed": null,
      "review_note": "Source locator includes the exact outer artifact and nested JAR path. Runtime API consumption and loader resolution were not exercised."
    }
  ]
}
